### ISSUE TITLE
buffer error?

### ISSUE THREAD

**Issue by abaluta** [cdevr/WapSNMP#14]
Good day.

I have a strange error. 

This part of the code:

hardwareInfo,herr := SnmpServer.GetTable([]int{1,3,6,1,2,1,47,1,1,1,1,2})
        if herr != nil {
              fmt.Printf("Error getting table => %v\n", SnmpServer)
              return
        }
        for currentOID, currentData := range hardwareInfo {
                fmt.Printf("Current: %s -> %s\n",currentOID,currentData)
                if result,_:=regexp.MatchString("^X[0-9][0-9][0-9].*", currentData.(string));result {
                        hoid,_:=strconv.Atoi(regexp.MustCompile("[0-9]+$").FindString(currentOID))
                        fmt.Printf("Found: %s -> %s\n",currentOID,currentData)
                        fmt.Printf("Get: %s%d\n","1.3.6.1.2.1.47.1.1.1.1.11.",hoid)
                        serialInfo,_:=SnmpServer.Get([]int{1,3,6,1,2,1,47,1,1,1,1,11,hoid})
                        fmt.Printf("%T : %v\n",serialInfo,serialInfo)
                }
        }

I run my program twice without recompiling, and: 
Output log:
# ./getequipment

2015/02/19 10:37:45 Couldn't read. Retrying. Retry 0/5
Current: .1.3.6.1.2.1.47.1.1.1.1.2.1 -> X670-48x
Found: .1.3.6.1.2.1.47.1.1.1.1.2.1 -> X670-48x
Get: 1.3.6.1.2.1.47.1.1.1.1.11.1
2015/02/19 10:37:48 Couldn't read. Retrying. Retry 0/5
string : 1215G-02547
Current: .1.3.6.1.2.1.47.1.1.1.1.2.2 -> PowerSupply Slot-1
Current: .1.3.6.1.2.1.47.1.1.1.1.2.3 -> PowerSupply-Internal
Current: .1.3.6.1.2.1.47.1.1.1.1.2.4 -> PowerSupply Slot-2
Current: .1.3.6.1.2.1.47.1.1.1.1.2.5 -> PowerSupply-External
Current: .1.3.6.1.2.1.47.1.1.1.1.2.6 -> FanTray
# ./getequipment

2015/02/19 10:37:52 Couldn't read. Retrying. Retry 0/5
Current: .1.3.6.1.2.1.47.1.1.1.1.2.1 -> X670-48x
Found: .1.3.6.1.2.1.47.1.1.1.1.2.1 -> X670-48x
Get: 1.3.6.1.2.1.47.1.1.1.1.11.1
2015/02/19 10:37:55 Couldn't read. Retrying. Retry 0/5
string : X670-48x
Current: .1.3.6.1.2.1.47.1.1.1.1.2.2 -> PowerSupply Slot-1
Current: .1.3.6.1.2.1.47.1.1.1.1.2.3 -> PowerSupply-Internal
Current: .1.3.6.1.2.1.47.1.1.1.1.2.4 -> PowerSupply Slot-2
Current: .1.3.6.1.2.1.47.1.1.1.1.2.5 -> PowerSupply-External
Current: .1.3.6.1.2.1.47.1.1.1.1.2.6 -> FanTray
# 

When I see the serial number - it is right. But it happens once in ten.
Your code is very beautiful and simple, but I do not see the error.

**Comment by cdevr** [comment]
Just pasting your code a bit more readably to try and wrap my head around this:

	hardwareInfo, herr := SnmpServer.GetTable([]int{1, 3, 6, 1, 2, 1, 47, 1, 1, 1, 1, 2})
	if herr != nil {
		fmt.Printf("Error getting table => %v\n", SnmpServer)
		return
	}
	for currentOID, currentData := range hardwareInfo {
		fmt.Printf("Current: %s -> %s\n", currentOID, currentData)
		if result, _ := regexp.MatchString("^X[0-9][0-9][0-9].*", currentData.(string)); result {
			hoid, _ := strconv.Atoi(regexp.MustCompile("[0-9]+$").FindString(currentOID))
			fmt.Printf("Found: %s -> %s\n", currentOID, currentData)
			fmt.Printf("Get: %s%d\n", "1.3.6.1.2.1.47.1.1.1.1.11.", hoid)
			serialInfo, _ := SnmpServer.Get([]int{1, 3, 6, 1, 2, 1, 47, 1, 1, 1, 1, 11, hoid})
			fmt.Printf("%T : %v\n", serialInfo, serialInfo)
		}
	}

**Comment by cdevr** [comment]
I think I have a theory : 

1) wapsnmp sends packet to device, request "reqA"
2) wapsnmp times out, reports error
3) you retry
4) device finally replies to your packet (let's call this reply repA)
5) wapsnmp sends the retry to the device -> reqB
6) wapsnmp receives "repA", returns it's data to you
7) device replies to the second wapsnmp query, sending reply repB
8) you construct a different query, call get
9) wapsnmp sends a query to device reqC
10) wapsnmp receives repB, returns it to your program 
11) device replies to query reqC, returning repC
12) ... repC arrives at the udp socket, but nobody's listening

So you get the first value of the last getnext from the gettable call.

This is a wapsnmp bug, I'll work on it.

**Comment by abaluta** [comment]
I "fixed" a bug. Increase timeout helps. Not a very good solution. :(
More debug. 
Before "fix":
10:16:24.842782 IP 10.12.2.2.35659 > 10.15.44.17.161:  C=totgfh0xre GetBulk(31)  N=0 M=50 .1.3.6.1.2.1.47.1.1.1.1.2
10:16:26.843834 IP 10.12.2.2.35659 > 10.15.44.17.161:  C=totgfh0xre GetBulk(31)  N=0 M=50 .1.3.6.1.2.1.47.1.1.1.1.2
10:16:27.352715 IP 10.15.44.17.161 > 10.12.2.2.35659:  C=totgfh0xre GetResponse(1058)  .1.3.6.1.2.1.47.1.1.1.1.2[|snmp]
10:16:29.852680 IP 10.15.44.17.161 > 10.12.2.2.35659:  C=totgfh0xre GetResponse(1058)  .1.3.6.1.2.1.47.1.1.1.1.2[|snmp]
10:16:37.358742 IP 10.12.2.2.35659 > 10.15.44.17.161:  C=totgfh0xre GetRequest(32)  .1.3.6.1.2.1.47.1.1.1.1.11.1
10:16:37.409602 IP 10.15.44.17.161 > 10.12.2.2.35659:  C=totgfh0xre GetResponse(43)  .1.3.6.1.2.1.47.1.1.1.1.11.1=[|snmp]
10:16:37.409628 IP 10.12.2.2 > 10.15.44.17: ICMP 10.12.2.2 udp port 35659 unreachable, length 36

Very strange that a small waiting time enough for gettabel, but not enough to simply get.

**Comment by cdevr** [comment]
The real fix is to introduce request ID checking in the various SNMP methods. Working on a patch.
